{
  "match_id": "20260120_ARS_AVL",
  "timestamp": "2026-01-20T15:00:00Z",
  "bookmaker_odds": [
    {
      "bookmaker": "draftkings",
      "home_win": 1.65,
      "draw": 4.00,
      "away_win": 5.50,
      "over_2_5": 1.90,
      "under_2_5": 1.95
    },
    {
      "bookmaker": "fanduel",
      "home_win": 1.70,
      "draw": 3.80,
      "away_win": 5.25,
      "over_2_5": 1.85,
      "under_2_5": 2.00
    },
    {
      "bookmaker": "betmgm",
      "home_win": 1.67,
      "draw": 3.90,
      "away_win": 5.40,
      "over_2_5": 1.88,
      "under_2_5": 1.98
    }
  ],
  "best_value": {
    "home_win": {
      "bookmaker": "fanduel",
      "odds": 1.70
    },
    "draw": {
      "bookmaker": "draftkings",
      "odds": 4.00
    },
    "away_win": {
      "bookmaker": "draftkings",
      "odds": 5.50
    },
    "over_2_5": {
      "bookmaker": "draftkings",
      "odds": 1.90
    },
    "under_2_5": {
      "bookmaker": "fanduel",
      "odds": 2.00
    }
  },
  "metadata": {
    "source": "the-odds-api",
    "fetch_timestamp": "2026-01-15T10:30:00Z"
  }
}
